{
  "$schema": "https://json-schema.org/draft/2020-12/schema",
  "$id": "https://github.com/ATR-Lab/acoustic-vocabularies/sound/schema/validator-config.schema.json",
  "title": "Validator configuration",
  "description": "Configuration read by av_sound.validate. The threshold is a decimal string so it parses to an exact fraction on every platform.",
  "type": "object",
  "additionalProperties": false,
  "required": ["config_version", "separation_threshold", "status", "description"],
  "properties": {
    "config_version": {
      "const": 1
    },
    "separation_threshold": {
      "description": "Minimum normalized 12-feature distance to every committed motif, as a non-negative decimal string.",
      "type": "string",
      "pattern": "^(0|[1-9][0-9]*)(\\.[0-9]+)?$"
    },
    "status": {
      "description": "Freeze status of the values in this file.",
      "type": "string"
    },
    "description": {
      "type": "string"
    }
  }
}
